{
  "enterprise_value_card_id": "VALUE-EB005-BATCH-NORMALIZATION-002-001",
  "task_id": "eb005-batch-normalization-002",
  "enterprise_reality": {
    "evidence_class": "W",
    "real_work_node": "Cell Painting batch normalization",
    "named_role": "scientific_analyst",
    "decision": "normalization choice",
    "downstream_action": "profiles->batch_diagnostics",
    "error_consequence": "over-correction erases biology while under-correction creates false hits",
    "human_owner": "domain_reviewer"
  },
  "utility_hypothesis": {
    "decision_quality": "preserve an auditable handoff",
    "risk_reduction": "over-correction erases biology while under-correction creates false hits",
    "adoption_test": "independent practitioner can reconstruct the stop/proceed rule"
  },
  "novelty": {
    "source_gap": "public workflow does not enforce this handoff contract",
    "new_information_or_control": "synthetic evidence-boundary and failure controls",
    "not_surface_variant": true
  },
  "status": "REVIEW_REQUIRED"
}
